{
  "$schema": "https://json-schema.org/draft/2020-12/schema",
  "$id": "https://polytypo.org/schema/locale.schema.json",
  "title": "polytypo locale data",
  "description": "Declarative typographic conventions for one locale. Literal strings, literal code points, string lists and enum values only — no patterns, no priorities, no expressions (docs/ARCHITECTURE.md section 5.1).",
  "type": "object",
  "additionalProperties": false,
  "required": ["locale", "name", "quotes", "dash", "ellipsis", "hyphen", "nbsp", "sources"],
  "properties": {
    "locale": {
      "type": "string",
      "pattern": "^[a-z]{2}(-[A-Z]{2})?$",
      "description": "BCP-47 language or language-region tag. Must equal the file name."
    },
    "name": {
      "type": "string",
      "description": "English name of the locale, for generated documentation."
    },
    "quotes": {
      "type": "object",
      "additionalProperties": false,
      "required": ["primary", "secondary", "elisionIdioms", "elisionClitics"],
      "properties": {
        "primary": { "$ref": "#/$defs/quotePair" },
        "secondary": { "$ref": "#/$defs/quotePair" },
        "elisionIdioms": {
          "type": "array",
          "items": { "$ref": "#/$defs/elisionIdiom" },
          "uniqueItems": true,
          "description": "Literal, closed-set elision idioms consulted only to decline pairing two NARROW quote marks as a quotation when the full context — the word immediately before the opening mark and the word immediately after the closing mark, not merely the elided content between them — matches (quotes.md 3.2's listed elision veto), e.g. English { left: \"rock\", elided: \"n\", right: \"roll\" } for \"rock 'n' roll\". Empty is the default and means no verified idiom of this shape — a missing citation is never a licence to guess. Matching the elided content alone (a bare word list) is insufficient and is not this field's shape: it cannot distinguish the idiom from an arbitrary quoted letter, e.g. \"The letter 'n' is common.\", which is exactly the false positive this three-part contract exists to avoid."
        },
        "elisionClitics": { "$ref": "#/$defs/elisionClitics" }
      }
    },
    "dash": {
      "type": "object",
      "additionalProperties": false,
      "required": ["parenthetical", "range"],
      "properties": {
        "parenthetical": {
          "enum": ["em-tight", "em-spaced", "en-tight", "en-spaced", "none"],
          "description": "Dash used for a parenthetical break. `-tight` means no surrounding spaces, `-spaced` means a regular space on each side (the leading one may later be made non-breaking by the nbsp rule). `none` means the rule must not substitute anything: either the locale has no verified convention, or the cited sources attest more than one form and rank none."
        },
        "range": {
          "enum": ["em-tight", "em-spaced", "en-tight", "en-spaced", "none"],
          "description": "Dash used between numbers and dates. Russian sets an em dash here. `none` means the rule must not substitute anything: either the locale has no verified convention, or the cited sources attest more than one form and rank none — a missing citation is never a licence to guess."
        }
      }
    },
    "ellipsis": {
      "type": "object",
      "additionalProperties": false,
      "required": ["abbreviatedAfterTerminal"],
      "properties": {
        "abbreviatedAfterTerminal": {
          "type": "boolean",
          "description": "When true, an ellipsis directly after `!` or `?` is written with two dots (`?..`) rather than three. Russian convention."
        }
      }
    },
    "hyphen": {
      "type": "object",
      "additionalProperties": false,
      "required": ["prefixes", "suffixes", "compounds"],
      "description": "Morphological forms whose hyphen must not break across lines. Empty arrays are the normal case — only a few languages have a normative list.",
      "properties": {
        "prefixes": {
          "$ref": "#/$defs/wordList",
          "description": "Word-initial forms written with a trailing hyphen, e.g. Russian \"кое-\"."
        },
        "suffixes": {
          "$ref": "#/$defs/wordList",
          "description": "Word-final forms written with a leading hyphen, e.g. Russian \"-таки\"."
        },
        "compounds": {
          "$ref": "#/$defs/wordList",
          "description": "Whole hyphenated forms, written with U+002D, e.g. Russian \"из-под\"."
        }
      }
    },
    "nbsp": {
      "type": "object",
      "additionalProperties": false,
      "required": [
        "beforePunctuation",
        "narrowBeforePunctuation",
        "afterShortWords",
        "abbreviations",
        "beforeUnits",
        "beforeNumber",
        "beforeWord",
        "afterSymbols",
        "initialBinding"
      ],
      "properties": {
        "beforePunctuation": {
          "$ref": "#/$defs/charList",
          "description": "Characters that take U+00A0 before them. Q-P (quotes.md 2.1, enforced by scripts/validate-spec.mjs): every entry must be a member of the quotes rule's CLOSEISH."
        },
        "narrowBeforePunctuation": {
          "$ref": "#/$defs/charList",
          "description": "Characters that take U+202F before them. Q-P (quotes.md 2.1, enforced by scripts/validate-spec.mjs): every entry must be a member of the quotes rule's CLOSEISH."
        },
        "afterShortWords": {
          "type": "array",
          "items": { "type": "string", "minLength": 1 },
          "uniqueItems": true,
          "description": "Lowercase words that must not be left at the end of a line; the space after them becomes U+00A0. Matching is case-insensitive only for the first character."
        },
        "abbreviations": {
          "type": "array",
          "items": { "type": "string", "minLength": 2 },
          "uniqueItems": true,
          "description": "Literal multi-token abbreviations written with regular U+0020; every internal space becomes U+00A0. Example: \"z. B.\"."
        },
        "beforeUnits": {
          "type": "array",
          "items": { "type": "string", "minLength": 1 },
          "uniqueItems": true,
          "description": "Units and signs that bind to a preceding number with U+00A0. Example: \"%\", \"km\", \"°C\"."
        },
        "beforeNumber": {
          "type": "array",
          "items": { "type": "string", "minLength": 2 },
          "uniqueItems": true,
          "description": "Abbreviations that bind to a following number with U+00A0. Example: \"Nr.\", \"S.\", \"art.\"."
        },
        "beforeWord": {
          "type": "array",
          "items": { "type": "string", "minLength": 2 },
          "uniqueItems": true,
          "description": "Abbreviations that bind to a following word with U+00A0. Example: \"г.\", \"ул.\", \"M.\", \"Mme\". Riskier than beforeNumber — list only forms whose binding is normative."
        },
        "afterSymbols": {
          "type": "array",
          "items": { "type": "string", "minLength": 1 },
          "uniqueItems": true,
          "description": "Symbols that bind to a following number with U+00A0. Example: \"§\", \"№\"."
        },
        "initialBinding": {
          "enum": ["none", "chain", "single"],
          "description": "N7's mode (spec 0.6.0, replaces the boolean bindInitials). \"none\": N7 disabled. \"chain\": binds only a confirmed sequence of two or more adjacent initials (Chicago's own \"two or more initials\" wording) — a lone initial next to an ordinary capitalized word is left alone. \"single\": additionally binds one lone initial to a following word (Jacques André's citation), which cannot structurally distinguish every genuine name from a sentence-boundary collision."
        }
      }
    },
    "sources": {
      "type": "array",
      "minItems": 1,
      "items": {
        "type": "object",
        "additionalProperties": false,
        "required": ["rule", "cite"],
        "properties": {
          "rule": {
            "enum": [
              "quotes",
              "dashes",
              "ranges",
              "ellipsis",
              "hyphen",
              "nbsp",
              "spaces",
              "apostrophe",
              "symbols"
            ],
            "description": "Which rule the citation is normative for. Values are rule ids from spec/rules/order.json — note the rule is `dashes`/`ranges` while the locale-data field both read is `dash`."
          },
          "cite": {
            "type": "string",
            "minLength": 8,
            "description": "Normative authority, named precisely enough to be looked up offline."
          },
          "url": { "type": "string", "format": "uri" },
          "note": { "type": "string" }
        }
      },
      "description": "Mandatory. Every locale-driven rule with non-default data must be covered by at least one citation (docs/PLAN.md section 6.1)."
    }
  },
  "$defs": {
    "quotePair": {
      "type": "object",
      "additionalProperties": false,
      "required": ["open", "close", "innerSpace"],
      "properties": {
        "open": { "$ref": "#/$defs/singleChar" },
        "close": { "$ref": "#/$defs/singleChar" },
        "innerSpace": {
          "enum": ["none", "nbsp", "narrow-nbsp"],
          "description": "Space inserted between the quotation mark and the quoted text, as in French guillemets."
        }
      },
      "description": "Q-W (quotes.md 2.1, enforced by scripts/validate-spec.mjs): open and close must share a WIDE/NARROW visual width. Q-A: if innerSpace is not \"none\", neither open nor close may be U+2019."
    },
    "singleChar": {
      "type": "string",
      "minLength": 1,
      "maxLength": 2,
      "not": { "enum": ["\"", "'"] },
      "description": "Exactly one Unicode code point, written as the literal character. maxLength is 2 only because a JSON validator counts UTF-16 units; the one-code-point rule is enforced by scripts/validate-spec.mjs, which is the portable check. U+0022 and U+0027 are forbidden: the quotes rule reasons about straight marks as input and would not terminate if a locale declared one as output."
    },
    "wordList": {
      "type": "array",
      "items": { "type": "string", "minLength": 2 },
      "uniqueItems": true
    },
    "charList": {
      "type": "array",
      "items": { "$ref": "#/$defs/singleChar" },
      "uniqueItems": true
    },
    "elisionClitics": {
      "type": "object",
      "additionalProperties": false,
      "required": ["before", "after"],
      "description": "quotes.md 3.2's span-boundary elision veto (spec 1.4.0). Consulted ONLY when one literal neighbour of a NARROW mark is modes.md 3.2's inline boundary marker, so it is vacuous in text mode, which produces no marker. The trigger is the marker, never the mode: an implementation must not gate this on a mode test (quotes.md 3.2). Decline-only: it can never widen what quotes pairs, only narrow it. Both lists empty is the default and a total no-op, and is the correct content for a locale with no citable closed set of such fragments \u2014 a missing citation is never a licence to guess.",
      "properties": {
        "before": {
          "type": "array",
          "items": { "type": "string", "minLength": 1 },
          "uniqueItems": true,
          "description": "Word fragments that stand immediately BEFORE an elision apostrophe and attach forward to the following word: French l', d', qu', n' give \"l\", \"d\", \"qu\", \"n\". Authored lowercase \u2014 the veto folds only the first code point, and only ASCII A-Z, so \"L'\" matches an entry \"l\" and \"QU'\" does not match \"qu\". Every code point must be LETTER; JSON Schema cannot express a Unicode-category constraint, so that is enforced by scripts/validate-spec.mjs against the same pinned table the engine uses, exactly as for elisionIdiom's left/right."
        },
        "after": {
          "type": "array",
          "items": { "type": "string", "minLength": 1 },
          "uniqueItems": true,
          "description": "Word fragments that stand immediately AFTER an elision or possessive apostrophe and attach back to the preceding word, or forward from a word-initial omission \u2014 the lists are positional, not attachment claims (quotes.md 3.2). English ships the possessive \"s\" alone (x's); the contraction fragments t, ll, re, ve, d and m are deliberately absent, having no attested occurrence flush against a span boundary. Dutch ships \"s\", \"t\", \"ns\", \"k\", \"m\", \"em\", \"r\", \"et\" ('s morgens, 't was, 'ns kijken). Same lowercase authoring rule and same LETTER-only constraint as \"before\"."
        }
      }
    },
    "elisionIdiom": {
      "type": "object",
      "additionalProperties": false,
      "required": ["left", "elided", "right"],
      "properties": {
        "left": {
          "type": "string",
          "minLength": 1,
          "description": "Literal word immediately before the opening NARROW mark, separated from it by exactly one permitted inline-space code point. Matched as a whole word (quotes.md 3.2), first code point case-insensitive, the rest exact. Every code point must be LETTER (quotes.md 3.2's Word definition) — not because the engine's literal matcher would fail to match a digit or punctuation code point (it would match those exact bytes wherever they occur), but because an entry outside LETTER would make runtime behaviour exceed what the normative Word definition authorises. JSON Schema cannot express a Unicode-category constraint, so this is enforced by scripts/validate-spec.mjs and scripts/gen-locales.mjs against the same pinned table src/engine/unicode.ts imports, not by this schema."
        },
        "elided": {
          "type": "string",
          "minLength": 1,
          "description": "Literal content between the two NARROW marks, matched exactly, code point for code point, no case leniency. Not constrained to LETTER: the match is a literal equality test, not a Word-boundary walk."
        },
        "right": {
          "type": "string",
          "minLength": 1,
          "description": "Literal word immediately after the closing NARROW mark, separated from it by exactly one permitted inline-space code point. Matched as a whole word, first code point case-insensitive, the rest exact. Same LETTER-only constraint as \"left\", enforced the same way."
        }
      },
      "description": "A closed-set elision idiom (quotes.md 3.2's listed elision veto). All three fields are required and non-empty: matching only `elided` cannot distinguish an idiom from an arbitrary quoted word and is not a supported shape."
    }
  }
}
